content,id
4652711565856153,塞尔维亚克鲁舍瓦茨曾是中世纪塞尔维亚的都城民族英雄拉扎尔建功立业的地方克市旅游局每年都会举行骑士节既纪念历史传承了文化又能吸引大量的游客受疫情影响今年的规模较小气氛也有点冷本地家庭亲子游取代外地游客成了节日的主体孩子们在家长的带领下骑小马射小箭也算是过了一把骑士瘾节日当然少不了塞的传统音乐和葡萄酒还有传统工艺品的展示节日的重头戏是拉萨里卡教堂的中世纪婚礼游客们在这里会回到中世纪参加皇家婚礼领略中世纪的服饰之美听着几百年前的古老歌谣吃中世纪大餐挺美的
4652462575980415,东莞职业技术学院东莞职业技术学院不给放假是真的恶心就算你要升本科能不能给一个我能接受的理由外地的孩子想回家车票又难买疫情当下别的学校是提前把学生放走你是把学生关在学校上万的学生呆在学校真的安全吗出了事情学校能承担责任吗非要等到真出事了才能体现校方的伟大吗微笑微笑微笑
4652710139792809,台湾疫情撑不下去了台餐厅业者哭着下跪求疫苗台湾地区疫情自五月中旬大暴发以来至今未有缓和迹象岛内产业哀鸿遍野观光旅宿业餐饮业首当其冲近日高雄市一位餐饮业老板在接受采访时直接在镜头前跪下哭喊我要疫苗直新闻的微博视频
4652599545168970,早上好聊聊基金谈谈健康这个周末大事不少国际评级机构标普预测鉴于中国有效控制新冠疫情并迅速开展疫苗接种工作年中国实际国内生产总值将增长在全球疫情肆虐的当下中国这个成就是非常了不起的大中国已经成为全球经济的动力引擎美国最近公布了月经济数据核心个人消费开支价格指数录得近年来的最大同比增幅美国的通货膨胀是否会持续有待观察但显然不太妙巨量发行的货币不仅冲击美国经济让美国房价飙升物价飙升也冲击着其它经济体例如德国楼市也持续大涨创下十几年来最大涨幅在一片通胀预期中好的基金显然是抗通胀有力的武器从技术指引看大浪继续向前推进特别是低估值板块有望迎来补涨今天健康话题聊聊猪油很多人聊这个事我之前和大家聊过一定要重视用油健康很多病都和油有密切关系用油不健康吃药也效果不好那么猪油健康不健康呢很多人不知道如何选猪油经常用那个肥油那肯定不好的猪皮下面与瘦肉连在一起的那个肥肉叫肥油让人增肥血脂高选猪油要用猪内脏外面成片成块那个油那个叫做猪板油猪板油对人的身体有一定好处能利三焦破冷结利血脉什么意思呢比如乳腺有问题的女性就是冷结血脉不通那么吃吃猪板油炒大白菜可以平衡雌激素破冷结是有益的还有些小孩身体消瘦不喜吃饭厌食父母带孩子看了无数三甲医院名医吃了很多药还是小瘦子有经验的名老中医遇到这种情况一般让停药叮嘱回家用猪板油炒菜下饭猪板油炒大白菜等等很快孩子胃口大开壮实起来很多人说神奇原因是什么呢原因是猪板油利三焦利肠胃通小便利血脉散宿血所以猪油这个问题不能简单的说好或者不好要注意两个事一个是选猪板油不要用肥油二是血压血脂血糖都没问题健康的人群适当吃吃猪板油炒菜是有益处的小孩特别是小瘦子吃猪板油炒菜对肠胃有好处大人瘦子也可以试试当然如果血脂血压血糖高了那就不要试了血管不好的人用橄榄油早安赞赞可爱
4652387900069055,疫情阻击动态广州中风险地区清零根据广东省新冠肺炎防控指挥办关于印发广东省应对新型冠状病毒肺炎疫情分区分级防控工作指引的通知经广州市新冠肺炎防控指挥部同意自年月日起广州部分区域疫情风险等级调整如下一荔湾区白鹤洞街由中风险地区调整为低风险地区二白云区永平街道集贤路集安街号集贤路号由中风险地区调整为低风险地区三其他地区风险等级不变光明日报全媒体记者吴春燕王忠耀
4652709158326337,结有道之友断无情之人后疫情时代报团取暖更重要焦作
4652709133681710,贾永婕黑历史照片被挖结识年友人揭她私下真实性格艺人贾永婕因在疫情严峻时不惜掏腰包捐出昂贵医疗器材和每日一百份的爱心便当被外界封为抗疫女神连蔡英文都亲自致电感谢认证其是美少女而相识贾永婕多年的好友最近在网路分享两人的黑历史照片从姐妹的视角分析贾永婕的真实个性
4652555509170582,美国疫情大家比较关心变异我把最近分享的信息汇总出来供参考目前在美国占实际上这个比例现在是越高越好因为确诊住院和死亡都没有显著上升这种情况下如果已经占比很高是好迹象如果比例还很低反倒更值得担忧
4652683094655608,台湾疫情台请宣传高端疫苗没想到翻车了笑微博公开课光计划衝鋒号角的微博视频
4652708403872127,为认真贯彻落实近期区委区政府关于疫苗接种有关工作要求构筑免疫屏障加快新冠疫苗接种进度尽快形成全人群免疫屏障持续巩固来之不易的疫情防控成果官渡区司法局迅速行动统筹部署提高思想认识压实责任加强动员组织把党员派出来沉下去到挂钩联系福保社区开展地毯式搜排未接种人员信息做好服务引导充分发挥党组织战斗堡垒作用和党员先锋模范作用全力推进全区疫苗接种全覆盖工作法治官渡法治官渡昆明官渡发布昆明官渡发布昆明司法行政昆明司法行政中共官渡区委组织部中共官渡区委组织部
4652707270887554,我了个去英国卫生部大臣的花边新闻竟然也要扯上中国只因摄像头是中国制造每日邮报认为卫生部大臣出轨的幕后黑手是中国这位在办公室演小片的卫生部大臣因出轨视频曝光而辞职一位在疫情中完全没有作为的失职官员最后竟然因为中国制造的摄像头揭露了他的放荡私生活而受到了惩罚呵呵呵呵呵
4652707090009239,連日破人確診馬來西亞宣布全國封鎖無限期延長馬來西亞新冠疫情持續膠著連續天單日確診數超過例馬來西亞首相慕尤丁今日宣布原訂於明日到期的全國第一階段封鎖將延長至每日確診數降至例換句話說大馬全國封鎖將無限期延長
4652706042742614,金圣圭确诊感染新冠韩国队长金圣圭已确诊感染新冠希望早点康复在疫情期间出席活动一定要注意好防范啊毒舌馆长的微博视频
4652706386673878,先介绍下肤况混合皮肤冬季混干夏季混油伴敏感及炎症很久以前不喜欢防晒爱好熬夜终于皮肤问题找上门来了疫情期间懒到连脸都不洗大规模爆痘期间做了微针效果显著但是留下了肤色不均毛孔增大等问题通过深蓝团购了光针微针的项目到了医院后面诊发现其实我最严重的不是痘印不是毛孔而且因为底层色斑造成了严重的肤色不均于是我改变了项目超皮秒英诺水光针机构的医生非常细心知道我怕疼时不时的还要询问我的感受非常贴心那么来说说效果吧距离第一次项目相隔了两周明显的就是肤色不均得到了很大的提升以及紧致度也是得到了加强医生也做出了客观的专业的判断关于斑一次效果肯定不会那么显著所以我办了次组合卡光电类的项目就是需要坚持而且从管家到面疹的医院都没有强推这种情况出现而且预约管理专业度整体服务舒适得当期待六次后的明显提升呢变美研究院变美研究院
4652706113783470,年全球游戏市场总规模约为亿美元同比增长角川调研最新报告全球游戏市场报告近日发售根据其中数据显示由于今年居家不出的人群大幅增长年总规模较去年剧增据悉年世界游戏市场总规模约为亿美元较去年剧增主要原因为年新冠疫情导致的大量玩家居家不出角川调研年全球游戏市场总规模约为亿美元同比增长
4652605025815128,注意该地月起将不再集中组织接种疫苗第二针近期德尔塔变异毒株致多国疫情反弹日钟南山说过去的密接概念已不适用目前国内正处于新冠病毒疫苗第剂次接种的关键阶段紧急提醒这地月起不再组织打第二针另外如出现以下种情况需延缓或不建议接种第剂次疫苗月起该地将不再集中组织接种第二剂新冠疫苗
4652705693566215,台湾疫情台灣疫情地圖台島本地疫情月中旬爆發近日看似趨緩惟屏東枋山卻發生人群聚感染今天台灣新增名本土個案其中例為居家隔離期間或期滿檢驗陽性者另新增例死亡死亡者達宗香港北角
4652705488309420,朋友圈太伤感了伤心所以脑子不好还是有好处的喵喵虽然三年虽然疫情虽然经历酷都过去了兔子总要开启下一段旅程总会遇到新的人分别是常态没人是例外干杯毕业快乐微风呼和浩特内蒙古工业大学
4652704943574198,陈时中今天报人数分別为新增例本土确诊病例及例境外输入另确诊个案中新增例死亡连续三天确诊病例回落至双位数台湾疫情
4652704930466384,一组胶片风的照片好久不拿相机都有点手生了周末闲着上艺术村溜一圈疫情下的艺术村显得好安静少了很多游客但却更显安逸了吃吃喝喝玩一会儿分外惬意生活的模样萌娃养成记泰国清迈
4652704695062577,因为疫情时隔年养起了长发允悲
4652704511821310,英特尔称芯片荒最糟糕的时候在下半年据报道英特尔在最新采访中预测芯片荒最糟糕的时候在今年下半年随后情况将逐步好转虽然看好芯片业反弹但他认为要到年芯片业才能真正恢复到疫情前健康的供需关系再度强调了对芯片行业的长期乐观判断他表示随着通信电动汽车和人工智能等如火如荼的发展全球对芯片的需求将非常强劲芯片业未来十年将迎来黄金时期
4652704062505672,不出什么疫情原因的话月会去参加成都印点管人无料发吧或者自带纸可以给来的人画签绘
4652703878222297,美好辽宁欢迎您大连高校接力打造暖心毕业季临近七月又是一年的毕业季从二合一毕业典礼毕业作品致青春等在做好疫情防控的前提下大连各高校接力启动花样毕业季活动祝福毕业生带着温度和力量走向新征途迎接星辰大海夏日里操场上一场二合一的特殊毕业典礼在大连海洋大学温暖开启原来为了让去年因为疫情没有毕业典礼的毕业生们不留遗憾大连海洋大学把今年与去年的毕业生组织到一起进行了一场相隔天而又刚刚好的毕业礼穿上学位服补拍毕业照进行拨穗仪式等这一波看似非常规的操作却成全了大连海洋大学新老两届毕业生们的双重美好今年的毕业季恰逢建党百年毕业前夕大连交通大学毕业生们带领学弟学妹们历时半年特别创作和排演的话剧选择进行了精彩展演通过沉浸和体验式再现五四运动奏响的爱国主义壮歌中共一大召开的重要时刻等这部超燃的原创作品不但成为学校开展党史教育的生动环节也让用青春之我创造青春之中国青春之民族成为大连交通大学毕业季的底色山水有相逢青春不散场毕业嘉年华毕业音乐会随着大连高校一系列毕业季活动暖心启航打卡毕业的同时我们也祝福毕业生相聚别离初心不负你们的征途是星辰大海辽视第一时间辽视第一时间辽视第一时间的微博视频
4652487674695426,台首见群聚专家坦言很可怕台湾更危险台湾首见境外移入个案引发的印度变异株本土群聚确诊者包括白牌车司机超商店员外籍移工等人专家表示的传染力非常强英国已有成民众接种疫苗却仍受影响引爆新一波疫情导致解封时间往后延台湾疫苗覆盖率不足且处于英国变异株的疫情之间坦言当下处境很危险一定要积极阻止大流行产生穷尽所有的力量来防疫
4652703332962262,钟南山院士国产疫苗对德尔塔毒株有效大家应该打有不少网友询问针对广东多地引发本土疫情的德尔塔变异毒株疫苗的保护力是否会下降呢对此国家呼吸系统疾病临床医学研究中心主任中国工程院院士钟南山教授日前发出最新研判正在全球范围内蔓延流行的德尔塔变异毒株具有传播力强潜伏期短等特点但不管是实验室结果还是真实世界的第一手资料都表明现在我们国产的疫苗对毒株还是有效的大家应该快点打疫苗新民晚报
4652703148674562,专家若变异毒株引爆疫情新西兰级封锁扛不住奥克兰的疫情暴发时我们用级封锁成功控制了病毒蔓延但新的毒株将会对这套警报系统构成挑战所以我们应当对级和级警报的规定进行重新设置网页链接
4652702745496311,不带累字表达你很累印度印度疫情不可思议不可理喻真实的印度孟买居然是这个样子的摊手摊手话筒话筒短线刀客的微博视频
4652702422795701,广州疫情德尔塔重症比例达专家探索建立免疫功能评估体系及时筛查重症在与新冠病毒突变株下称德尔塔交手一个月后月日广州中风险地区终于清零全市均为低风险地区从临床救治角度上德尔塔有何特点广东积累了哪些救治经验专家组认为从临床上观察德尔塔重症比例达救治过程中专家组探索建立了一套免疫系统评估系统及时发现病情恶化的指标实现早期阻断转重症化趋势同时中医治疗重症发挥了一定疗效强调扶正多使用参汤补气广州中医药大学副校长广东省中医院副院长张忠德在临床上我们发现病人发热比例很高超过其中高热温度超过摄氏度的比例高达由于德尔塔病毒载量高患者感染后病情进展很快既往要天才转为重症这一次不到天就有可能转为重症严重者在小时内转为重型或直接转为危重型这为救治工作带来了不小挑战从临床表现来看年龄超过岁有基础疾病持续高热不退氧合能力下降等是轻症转向重症的高危因素相比之下小孩转重症的比例低很多北京协和医院重症医学科主任隆云目前新冠肺炎病毒治疗暂无特效药治疗原则是提升病人自身免疫力控制病毒在体内复制的速度首先我们会关注病毒核酸载量如果载量高患者病情进展可能就加快第二是自身抗体滴度如果病毒入侵后在一段时间还未产生抗体或者是抗体滴度不高这说明免疫系统还处于一个薄弱的状态第三是淋巴细胞基数病毒入侵体内后淋巴细胞最先受到攻击通过一项血常规检查我们就能得到淋巴细胞是否在减少如果是说明病毒此时正在体内高速复制在治疗过程中专家组实时动态监测病人其他指标如影像学表现全身炎症反应氧合状态等做到有的放矢精准干预让治疗能取得更好的效果隆云我们还是提倡提早氧疗及俯卧位治疗新冠肺炎的炎症渗出通常是在双侧肺的下部患者平常多为仰卧这些炎性渗出液就堆积在下肺的后背部采取俯卧位的时候双肺炎性渗出就不会聚集在下部可以改善肺水的流动和肺的氧合同样我们发现了接种疫苗后几乎没有发生重症和危重症病例这说明疫苗在阻断重症趋势上有一定效果但这一结论仍需要更多权威数据支持南方日报视频视频的微博视频
4652702368007857,伞兵伞兵宠粉季就是在疫情的时候我的好姐妹一直在看我就开始好奇跟她一起看然后无意在微博上看到了一个关于和平精英的最帅电竞选手的帖子下面很多姐妹都在评论伞兵就很好奇那个时候我又不知道伞兵是那个然后看到个姐妹了就看到了我还感叹了就看到了我还感叹是他们中粉丝最多的然后后面看比赛就会多关注的名字而且那个时候击杀榜也常常有然后就越来越有兴趣渐渐地就越来越关注完了我就爱上了一发不可收拾地爱了一年多了害羞
4652702339171008,家庭代工耍诈老兵跑腿吃官司疫情期间不少人失业诈骗集团看准民众兼差赚钱心理在网路张贴家庭代工广告利诱民众寄存折后请收簿手至铁公路置物柜领包裹被害人直到帐户被警示才知受骗高市警方日在台中逮获嫌其中嫌还是岁退伍军人
4652598784951806,台湾立荣航空飞厦门一航班上人确诊台湾流行疫情指挥中心竟声称应该没有感染性口罩的一边是日本另一边是美国脸往哪放呀是真卖国呀还是中国人嘛津门咚咚枪的微博视频
4652701944384162,慈濟防疫與安心物資日即時送抵屏東枋山屏東縣枋山鄉出現印度病毒確診案例為落實防疫屏東縣政府對枋山鄉楓港村善餘村超市超商餐飲業傳統市場等場所關閉三天居民全面篩檢慈濟基金會於月日緊急啟動屏東枋山地區防疫及長者安心營養補充物資支援並於日中午送達枋山地區慈濟基金會於日為協助屏東縣政府針對枋山群聚案防疫強化措施全力防堵傳染鏈於日從桃園八德及三重急調提供適合長者營養補充食物共千袋防護面罩千個及可供天使用的一般醫療級口罩千片於日晚上運抵慈濟屏東分會並於日早上進行打包作業後慈濟防疫物資與營養補充物資於日中午冒雨送往枋山地區供屏東縣衛生局及鄉公所發給當地兩村民眾防護及營養補充使用從今年月台灣本土疫情爆發後慈濟基金會就陸續提供防護面罩超過萬千片手套超過萬雙安心祝福包口罩營養補充品給屏東地區進行防疫及民眾營養補充之用慈济台湾疫情
4652701512106799,疫情下的香港本港疫情反復本港消息今日新增宗輸入個案宗與歲機場地勤男的相關個案本港連續兩天本地零確診斷纜由於沒有源頭不明個案衞生防護中心及醫管局下午不設疫情記者會德爾塔病毒着實犀利香港旺角
4652686849608389,今年在研究为什么美国页岩油钻井数量恢复比往年慢滞后很多的原因的时候一定不要忽视一个重要的要素那就是疫情和财政补贴造成的广泛的人的短缺不出门无法出门工作的失业这会造成即便价格投资等要素都具备的情况下依旧无法像年那样正常有效恢复供给这个问题我看很多人都忽略了现在的问题是如果未来半年全面就业恢复加速的话那么供给的制约因素什么时候开始缓解
4652700992016064,重要提醒接种点工作时间延长下班时间也可接种疫苗根据国家和省市区疫情防控办关于加快推进新冠病毒疫苗接种的工作要求从即日起各接种点疫苗接种工作时间延长到晚上点请还未完成第二剂次接种的居民群众合理安排好自己的时间按照下图对应时间就近到接种点及时接种力争保质保量完成全市第二剂次疫苗接种任务重点提醒一定要看清自己的第一针接种时间带好身份证带上第一针接种凭证带好口罩不要空腹接种前一天不要喝酒详情重要提醒接种点工作时间延长下班时间也可接种疫苗
4652700584906732,紧急提醒请尽快接种第二针剂疫苗当前全球新冠病毒肺炎疫情形势依然严峻复杂按时接种新冠病毒疫苗是预防和控制疫情传播的最有效手段为了您和家人的健康巩固我区来之不易的疫情防控成果请接种完新冠病毒灭活疫苗第一针剂后满天的市民于月日前到居住地的接种门诊进行第二针剂
4652700074249041,雅思哥粉丝求助希望可以听听大家的意见年月打算去约克读书现在语言班已经在上了但是疫情那边又严重了有点担心本身还有一个格拉的好像可以延期到明年月这个情况我还要不要今年九月去呢要是明年月再重新申请的话可能会申请到比较好一点的本科独立学院均分教育类专业回国的话有可能有机会落户北京感谢
4652700072939278,国务院联防联控机制综合组广东工作组看望参与疫情防控报道的媒体记者雷海潮指出此次广东疫情应急处置是我国首次应对新冠病毒变异株为我国今后有效应对处置变异株积累了宝贵经验广东在个月内处置了三起独立的境外输入疫情凸显我国外防输入的巨大压力在此次疫情处置中广东省及其相关地市均及时对防控策略进行实时优化调整不断丰富完善疫情防控措施并运用了新技术新方法推出了新规范新指南积累的经验与认识将为全国疫情防控工作提供重要的参考和借鉴其中广东在一个月内完成超亿人次的核酸筛查月日核酸检测超过万人次创造了两项全国纪录规定持有小时内核酸阴性结果才能外出旅行为全国建立了防范疫情风险外溢的管控新标准南方日报国务院联防联控机制综合组广东工作组看望参与疫情防控报道的媒体记者
4652699586396342,呼吸道合胞病毒在美国蔓延众所周知因为疫情原因美国失业率正在不断攀升当前有许多民众都是靠国家救济来维持生活而如今干旱更是让这些民众的生活雪上加霜与此同时美国还频发山火这更是大大加重了消防员的工作量据悉月还不是山火的高发期月和月才是看来美国将迎来一场严峻的考验
4652344375773373,小泉孝太郎主演医院的治疗方法将于月日播出高岛政伸等人续投加藤成亮出演描绘直面新冠疫情的地方医疗的现实状况
4652699003652185,世卫德尔塔变异毒株致多国疫情反弹至少个国家和地区发现德尔塔变异毒株世界卫生组织表示全球新冠疫情有放缓迹象每日新增病例降至月以来最低死亡人数也呈下降趋势不过传染性更强的德尔塔毒株正在越来越多国家导致病例激增全球抗疫形势仍严峻世界卫生组织总干事谭德塞日曾说德尔塔毒株是迄今发现的传染性最强的新冠病毒已有至少个国家和地区发现了这一变种毒株
4652688732587124,每经整点播每经午时泰国曼谷及周边地区月日起实行封城措施当地时间月日凌晨泰国总理巴育签署紧急命令法宣布自月日开始对泰国首都曼谷及周边地区佛统府暖武里府巴吞他尼府沙没沙空府实行封城措施封城具体措施为封锁经常暴发疫情的建筑工地天所有餐厅禁止堂食仅提供外卖服务商场只开放至酒店展览中心会议中心照常营业但禁止组织会议研讨会及宴会在未经相关管理部门批准的情况下禁止组织二十人以上的聚集活动央视阿法更多每经午时农夫山泉拂晓白桃味苏打气泡水产品配料中没有从日本福岛进口的成分出行提示月日北京公交地铁将进行运营调整每经午时泰国曼谷及周边地区月日起实行封城措施
4652686186909565,疫情未停仍需防护戴口罩勤洗手打疫苗一件都不能少哟我的地铁我的城图李兆豪
4652698652116382,房子是租的但生活不是居家的日子里终于一步步把房子布置成自己喜欢的样子待疫情结束我要把我滴姐妹们都约过来玩
4652698533891311,结课疫情封校暑假倒计时天要好好珍惜校园生活呀另外祝朱依琳和小梁毕业快乐广州广州大学大学城校区
4652695741271237,不是我的觉悟不行不想投入一线抗疫而是希望广州疫情快点结束再也不需要我们广州青年志愿者支援抗疫一线逾十万人次广州加油广州粤溪村天德花苑
4652666694667676,骄傲月消除误解和歧视每年的月是骄傲月每一年我们都要说每个人都有可能感染跟性取向无关坚持服药可以达到病毒检测不到的水平检测不到不会传染每一种爱都应该被尊用对于群体的歧视和误解只会阻碍艾滋病疫情的防控更加包容的社会更有利于疫情的防控在最新通过全球艾滋病防治政治宣言中各国承诺努力实现对艾滋病毒感染者易感染者和受影响者零污名化与零歧视的愿景利用检测不到不传染等倡议的潜力确保到年遭受污名化与歧视的人低于确保最高级别的政治领导以消除一切形式艾滋病毒相关污名化与歧视包括通过全政府全社会和多部门应对行动促进加强政策一致性和协调行动确保所有服务的设计和提供不存在污名化与歧视充分尊重隐私权保密权和知情同意权联合国艾滋病规划署会和各国政府社区组织等密切合作确保政治宣言的落实实现年终结艾滋病的目标
4652666161991748,世界黄金协会最新公布的数据显示年全球黄金产量达吨亿盎司连续第二年小幅下滑此前黄金产量持续多年增长此外世界黄金协会还披露了最新的全球前十大黄金生产国排名中国依然是全球最大的黄金生产国和消费国除了疫情这一明显因素勘探预算稳步萎缩也是去年黄金产量下滑的一大原因这不禁引发人们的疑问黄金产量的峰值是否已经到来容易开采的金矿已经被相继采掘规模达数百万盎司的超级黄金矿床的发现速度也大不如前就拿南非来说该国曾是全球黄金产量最大的国家年的产量超过吨但此后快速下滑去年甚至跌出了全球前十大黄金生产国的行列来源矿业投资圈新一轮的黄金矿产资源枯竭老化来临而美元还在不停得印
