content,id
4652622906394251,健康发布截至月日时新型冠状病毒肺炎疫情最新情况月日时个省自治区直辖市和新疆生产建设兵团报告新增确诊病例例均为境外输入病例云南例福建例北京例天津例上海例广东例四川例无新增死亡病例无新增疑似病例当日新增治愈出院病例例解除医学观察的密切接触者人重症病例较前一日减少例境外输入现有确诊病例例其中重症病例例无现有疑似病例累计确诊病例例累计治愈出院病例例无死亡病例截至月日时据个省自治区直辖市和新疆生产建设兵团报告现有确诊病例例其中重症病例例累计治愈出院病例例累计死亡病例例累计报告确诊病例例无现有疑似病例累计追踪到密切接触者人尚在医学观察的密切接触者人个省自治区直辖市和新疆生产建设兵团报告新增无症状感染者例均为境外输入当日转为确诊病例例均为境外输入当日解除医学观察例境外输入例尚在医学观察的无症状感染者例境外输入例累计收到港澳台地区通报确诊病例例其中香港特别行政区例出院例死亡例澳门特别行政区例出院例台湾地区例出院例死亡例
4652759418409728,老年双人组周末的一天本来是打算出门吃个煲仔饭再去网吧放纵一下玩个一下午脑袋突然一闪光决定去吃久违的赛百味拍糊了刚好赛百味所在地的商圈就有网咖十分完美吃完依旧晕乎乎刚准备去网咖悲痛发现因为疫情网咖全关门了不死心地挪过去看看大门紧闭烈日当头爬进商场里坐下开始搜索可以进行的娱乐活动例如歌之类结果不是附近的关门了就是好玩的都在很远的地方最后的最后我们斥巨资去关闭的电影院门口享受了分钟的按摩椅全身唤醒套餐啊又是老年的一天
4652759401631271,英国英国疫情英国英国国家医疗服务体系表示到周日月日英国岁以下的成年人中有一半将接种第一剂疫苗在疫苗接种计划向多岁人群开放后的三周内超过万至岁的人群接种了疫苗表示超过五分之四的成年人现在已经接受了第一剂接种超过的人接种了第二剂
4652759398222871,游泳小时个来回因为疫情游泳馆闭馆了一年多我也一年多没有下水了就连泳帽的松紧都劈了游一个半程就要整理一次泳帽好担心游的过程中泳帽给飞了那真的是太丢脸了允悲允悲允悲柳州柳钢游泳馆
4652759351821060,我妈做饭水平忽高忽低但是唯独做豆芽炒猪红就非常好吃也很下饭我记得我以前放学回去只要有这个菜我可以干掉两碗米饭也许是想念那个下课回家就有热饭菜吃的时刻也许只是因为那道菜特别好吃今晚就吃它了即便是疫情也要好好吃饭呀有一种英雄主义是过来生活的每一天就从捣鼓每一餐开始最近新买了烤箱解锁了很多新菜谱欢迎四面八方的人儿来做客呀享受在厨房捣鼓的日子也很欣慰于无论我做什么好吃或不好吃我室友每次都能光盘
4652759330329315,张明同志带队督导检查高台县看守所近期安全管理工作月日上午市公安局党委委员副局长张明带领市局监管支队负责同志到高台县看守所督导检查建党周年安保维稳期间监所安全管理和疫情防控等工作县公安局党委委员副政委李文军陪同检查检查组查看了监所疫情防控工作台账业务台帐和应急处突预案等资料听取了县看守所负责人关于近期监所安全管理维稳安保疫情防控和值班勤务等相关工作汇报检查组对看守所落实疫情防控各项措施监所安全管理值班勤务运行和应急演练等方面的工作给予了充分肯定和高度评价同时结合建党周年安保维稳工作就监所安全管理工作提出了具体要求张明同志强调一要持续抓实抓好七一建党节期间安保维稳暨监所安全管理工作严格落实监管场所各项制度规定进一步优化勤务运行机制严格公正文明执法确保监所安全稳定二要持续抓实抓细监所疫情防控工作要严格执行监所疫情防控高于社会面防控标准的总要求严把收押关出入关隔离关消毒关食品采购关做好民辅警自身及家属的防疫工作确保监管场所疫情零感染三要持续抓实抓细在押人员管理教育工作落实在押人员日常行为规范一日生活制度和群进群出夜间双人值班面对面管理教育医疗卫生出所就医等各项规章制度强化被监管人员行为习惯养成确保监所安全稳定四要持续抓好队伍管理要认真汲取其他监所安全事故教训加强谈心谈话和警示教育进一步规范执法行为严格遵守各项纪律规定提高风险意识筑牢民辅警思想和纪律防线坚决杜绝违规违纪违法事件五要继续开展监所安全隐患大排查工作组织值班民辅警全方位开展各类隐患排查整治切实堵塞安全隐患漏洞确保监所的绝对安全甘肃公安甘肃公安张掖公安张掖公安
4652742854840779,德尔塔变异毒株已进入台湾社区台疫情指挥中心除了公布日新增例本土新冠肺炎病例人死亡外指挥官陈时中指出屏东县出现了变异毒株群聚感染事件目前累计例经基因定序後均为德尔塔变异毒株感染为避免疫情扩大须采取相关应变措施陈时中表示德尔塔变异毒株已经进入社区所以需要精准疫调扩大划定接触者及采检范围接触者须隔离接受检疫观察央视网快看的微博视频
4652759176185578,中山记录中山身边事中山扩散周知中山这个客运站暂停营业近期有出行计划的街坊注意月日益华客运站发布通告月日起暂停营业公告称因新冠疫情防控需要积极配合落实非必要不离开中山不出省的抗疫号召经研究后决定益华客运站于年月日至月日期间暂停营业月日恢复正常营业中山
4652719581954967,越南外卖小哥街头演唱的两首歌和其实不想走的越南翻唱版本在越南地位相当于美团在这边地位可以看看在这次疫情二次爆发前越南南方城市的夜生活鱼翅捞饭和蒜的微博视频
4652759121397998,国外疫情有重新抬头的趋势可能性
4652750689799809,官网更新金圣圭相关公告一则你好是当事所属艺人金圣圭君疫情确诊了金圣圭君因行程关联是每周有定期的检测核酸的情况日虽接种杨森疫苗但是日今天早上得到了确诊因此金圣圭君的所有行程将会中断根据当国防疫守则会进行必要的措施和一定的安定现在和金圣圭君动线有冲突或者接触过的关联工作人员和职员也都做完了核酸检测结果出来之后即会进行自我隔离我们会最优先考虑艺人和职员们的安全今后会更加严谨的遵守疫情守则和今后的防疫管理并且为了金圣圭君的快愈和复出我们会竭尽全力再次向担忧的人们传递歉意的心谢谢翻译转载请注明吧
4652742854840779,德尔塔变异毒株已进入台湾社区台疫情指挥中心除了公布日新增例本土新冠肺炎病例人死亡外指挥官陈时中指出屏东县出现了变异毒株群聚感染事件目前累计例经基因定序後均为德尔塔变异毒株感染为避免疫情扩大须采取相关应变措施陈时中表示德尔塔变异毒株已经进入社区所以需要精准疫调扩大划定接触者及采检范围接触者须隔离接受检疫观察央视网快看的微博视频
4652759176185578,中山记录中山身边事中山扩散周知中山这个客运站暂停营业近期有出行计划的街坊注意月日益华客运站发布通告月日起暂停营业公告称因新冠疫情防控需要积极配合落实非必要不离开中山不出省的抗疫号召经研究后决定益华客运站于年月日至月日期间暂停营业月日恢复正常营业中山
4652719581954967,越南外卖小哥街头演唱的两首歌和其实不想走的越南翻唱版本在越南地位相当于美团在这边地位可以看看在这次疫情二次爆发前越南南方城市的夜生活鱼翅捞饭和蒜的微博视频
4652759121397998,国外疫情有重新抬头的趋势可能性
4652661518895854,今天生日一早隔离点解除隔离人员名算个好消息吧生日愿望是疫情能早日结束加油不瞒了王医生在隔离点快憋坏了笑笑深圳大梅沙魔术医生王建伟的微博视频
4652751211200761,新冠患者会出现沉默性低氧安静时不缺氧稍稍一动就喘不上气南方日报南方广州这一轮本土疫情中无症状感染者比例不高您如何看北京协和医院重症医学科主任隆云有时候无症状更多是病人自身感受新冠患者在先前的临床观察中往往会出现沉默性低氧也就是说安静待着的时候不缺氧而稍稍一动就会喘不上气影像往往会出现渗出改变之前的很多所谓无症状感染者从医学上角度来说是不严谨的当然不排除少数人是无症状感染但多数还是有症状病人有感冒表现比如头痛流涕畏寒低热等从临床上说符合轻症或普通型诊断首次与德尔塔变异毒株交手顶级中西医专家找到了这些新规律和方法广州疫情广东疫情
4652758844312405,疫情时间的单向就座真是太太太适合我了十块钱的照烧鸡扒饭性价比没谁了还是要多多记录下我的研究生生活广州华南师范大学石牌校区
4652758798434931,第四轮核酸来了第五轮还会远吗笑医务人员和义工们都太不容易了愿疫情早日过去生活早日恢复正常
4652758756756638,给一组数据帝都月绿成交量年套年套年套有疫情影响年约套年月分别比年同期增
4652758697773889,银河证券全球锂资源确定性紧缺预计锂精矿价格将持续上涨银河证券研报指出政策驱动叠加疫情后消费回暖全球新能源汽车高速增长强力拉动锂需求预计年全球锂需求同比增长万吨至万吨而同期可释放的有效新增产量万吨锂资源年供需边际趋紧叠加下半年动力电池与正极材料在进入旺季与新产能释放排产预期环比大幅提升的情况下预计锂精矿价格将持续上涨北京新悦家园
4652746227056866,今日隔壁全球疫情已经更新印度毒株新变种已有两个分支一个全球肆虐另一个暂时只在美国这玩意就是在广东秒传人那个广州出现最短秒传播病例巴西总统基本疯了不但自己摘口罩叫嚣甚至公众活动摘了个支持他的小男孩的口罩拉美欧洲非洲亚洲正在逐渐被印度毒株全面接管英国反弹到单日新增万确诊基本都是印度毒株印尼飙到单日万确诊还是印度毒株他们还有其他所有变种毒株南非飙到单日万确诊其中都是印度毒株这可是毒株南非毒株的大本营啊也就拉美还是巴西毒株多点但哥伦比亚都飙到日均万确诊的水平了日本人继续浪费疫苗并鞠躬日本疫苗接种出现近起失误这个话题很实用鞠躬是本子永恒的旋律比如又把大麦茶放进冷柜直接报废全部疫苗澳洲隔离酒店又坑了这一期非洲的消息多了一些还有比较少提到的中亚地区全球新冠疫情杂谈印度毒株接管全球疫情
4652758617298165,因为疫情所以这次深圳客人可以来上海复诊这对江西的姐妹花大家应该不陌生姐妹俩都是二次矫正姐姐属于整齐龅牙妹妹是严重深覆合妹妹比姐姐晚一年戴牙套周医生的目标就是把不一样的双胞胎变成一样你们猜得出谁是姐姐谁是妹妹吗思考如何看待形式公平和事实公平安心变美狂欢季上海上海美行口腔门诊部鉴星牙齿矫正南京西路店
4652758608645878,和我的两个妹妹在宿舍楼梯的合照抱一抱抱一抱本来等着在级的时候跟另一位妹妹一起拍这样就都齐啦可是计划不如变化呜呜呜因为疫情我们无法回广州再见下次一定要回去再拍哦
4652758496710204,伦敦爆发大规模反封锁抗议英首相约翰逊决定将英国的开放时间推迟到下个月晚些时候引发不满如此抗击疫情如何落实到位啊自由如此应用德尔塔有人的思维的话估计会让德尔塔都惊呆了
4652758471545251,出入境人员逃避检疫六类行为以妨害国境卫生检疫罪定罪处罚包括不如实填报健康申明卡等方式隐瞒疫情豪宅最的微博视频
4652758336278827,印度德尔塔变异毒株感染病例增至例目前德尔塔变异毒株正在印度不断蔓延印度疾控中心数据显示截至日印度已经确诊了例感染德尔塔变异毒株的病例德尔塔毒株是从德尔塔毒株变异而来的多了一个能引起免疫逃逸的代号的突变其传播能力比德尔塔毒株还要强德尔塔变异毒株致多国疫情反弹央视网央视网央视网的微博视频
4652758324479665,鲜花广州又多一打卡点像蓄势待发的疫苗大针弓箭一样杀气大传说是风水局一开通疫情瞬间清零偷笑偷笑偷笑
4652758278342140,那坡县今天晚上到明天白天多云转阵雨到摄氏度东南风到级发热咳嗽的人要及时报告马上就医发现外来人员要及时报告防止疫情传入那坡那坡县气象台日时供网页链接
4652735423057222,疫情快让我得强迫症了总感觉最安全的还是宅家开放堂食了也不敢坐公车和出门笑笑不直接摸电梯和其他公共按钮稍微摸一下都得洗手或者酒精棉片和免洗洗手液笑有跟我一样的吗笑不出门所幸家里可以让我玩的东西还真是多又把书衣拿出来套上了新的本子认真看了看这个以前买的数字书衣因为白色我一直怕弄脏没怎么用但竟然是日制的之前根本没注意哈哈小的活动获得了两个可爱的小模型呀呀也太可爱了按钮还能滑动不错嘛没有抽到红色虽然有点遗憾手帐给你看看我的手帐吧
4652757531230576,这就是在台湾万华街头猝死的外籍男子在其死亡后检测发现新冠肺炎确诊这名外籍男子是欧洲人士来台居住已经年不是近日入境的外籍人士无心简影的微博视频
4652758097723874,天天响应天天核酸结果时间次次拖延不准每个核酸点要不就直接原定时间拖一个小时说是点结果点半了说是吃饭去了我们有的点就到了等到现在你们定好的时间又去吃饭了我们群众时间就是无关紧要理解但不是就能忍这么多次糊弄有点时间观念吧我们都重视疫情感谢检疫人员但这不是可以忍多次的理由大白天热度多少动不动还下雨大家都同样辛苦深圳卫健委深圳卫健委
4652728092198800,刀哥坐标武汉两套住房一套自住一套出租无贷款因为疫情影响房价降了孩子三四年后出国读书是应该等那时再卖还是现在出手持币投资出租房在武汉三环外房龄超十年增值空间较小我回答了约定秀约定秀的问题大家快来围观微博问答
4652757712112238,绮然自乐闺蜜开心聚会缺了几个周末相聚更加珍惜图三的小马蹄好可爱啵一起庆祝疫情将要结束干杯干杯干杯
4652752322694467,疫情过去以后还是要想办法搞一次西伯利亚大铁路的横穿旅行乘现在自己还年轻
4652750979207782,罗马的金宫在疫情后首次重新向公众开放伴随着一场沉浸式展览这场展览原本应该在年举办作为拉斐尔逝世周年纪念但因为疫情推迟到今年当时在发现金宫的古代壁画过程中拉斐尔做过很大贡献展览起名为拉斐尔和金宫穴怪图像的发现在尼禄的八角厅开幕当年通过八角厅的圆顶拉斐尔和其他艺术家用绳索降落到这座巨大的遗址内发现了久违的华丽画作植物动物人物形态交织在一起这种风格后来被称为穴怪图像这些画作在年首次曝光后来穴怪图像被许多贵族用来装饰房屋比如佛罗伦萨的乌菲兹和旧宫展览时间年月日年月日周一周四有陪同周五周日有讲解员周末的参观比平日的内容多票价周一周四欧周五周日欧地点入口公园内图意大利旅行罗马旅行
4652757577632470,澳大利亚疫情今天第二魔幻新州爆发疫情日澳洲总理魔力僧说全澳只有一个州有着世界最好的黄金标准追踪系统可以不靠封城就对付病毒话音刚落新州格格巫州长就对四个颁布了令坚决不说日新州一天开两次新闻会说我们要两周允悲
4652757451015325,民进党刁难民间买疫苗孙大千怒这是台湾人的悲哀台湾疫情台湾新冠肺炎疫情严峻急需疫苗来舒缓疫情但目前政府采购疫苗数量却少之又少只能靠捐赠的疫苗来苦苦支撑鸿海慈济台积电等民间企业从上个月开始就陆续出现主动要采买疫苗提供民众施打的声音但如同石沉大海没收到正面的回应直到近日才陆续谈妥购买的相关事宜
4652757207744600,出入境人员逃避检疫市公安局通报典型案件男子隐瞒出入境行程违反管控规定被行拘战胜疫情行动豪宅最的微博视频
4652713586987398,好辣泰国人在韩国团天天买中国热搜还是中国的钱最好赚吧之前爱奇艺的节目就很无语子请她过来当导师疫情期间还要远程连线又不会说中文全程尬聊中国的唱跳女艺人平台就是不给机会
4652757577632470,澳大利亚疫情今天第二魔幻新州爆发疫情日澳洲总理魔力僧说全澳只有一个州有着世界最好的黄金标准追踪系统可以不靠封城就对付病毒话音刚落新州格格巫州长就对四个颁布了令坚决不说日新州一天开两次新闻会说我们要两周允悲
4652607764696162,年月日重庆市新冠肺炎疫情情况一本地疫情月日时重庆市本地无新增新冠肺炎确诊病例报告截至月日时重庆市本地无在院确诊病例累计治愈出院病例例累计死亡病例例累计报告确诊病例例二境外输入疫情月日时重庆市无新增境外输入新冠肺炎确诊病例报告截至月日时重庆市现有境外输入在院确诊病例例为尼泊尔输入累计治愈出院病例例累计报告境外输入确诊病例例三无症状感染者月日时重庆市无新增无症状感染者报告截至月日时尚有无症状感染者例均为境外输入其中尼泊尔例菲律宾例正在接受医学观察四密切接触者截至月日时累计追踪到密切接触者人已解除医学观察人尚有人正在接受医学观察
4652757451015325,民进党刁难民间买疫苗孙大千怒这是台湾人的悲哀台湾疫情台湾新冠肺炎疫情严峻急需疫苗来舒缓疫情但目前政府采购疫苗数量却少之又少只能靠捐赠的疫苗来苦苦支撑鸿海慈济台积电等民间企业从上个月开始就陆续出现主动要采买疫苗提供民众施打的声音但如同石沉大海没收到正面的回应直到近日才陆续谈妥购买的相关事宜
4652757308671770,在抖音刷到泰剧马兜铃太上头了结果因为疫情就拍了集赶紧出续集也太帅了泰剧
4652701951984907,年上半年线下总结自从疫情我就再也没跑出去过没想到年这上半年我竟然跑了这么多个地方见了这么多人很久都没有这么丰富多彩的生活了除了北京之外还有天津武汉郑州石家庄平遥从到上半年就这么过去啦希望下半年能有更多快乐抱一抱
4652757207744600,出入境人员逃避检疫市公安局通报典型案件男子隐瞒出入境行程违反管控规定被行拘战胜疫情行动豪宅最的微博视频
4652721338318975,刚刚当值主任和人事主管请示原计划月入职的两位医生可否正常入职疫情应该问题不大了正常入职吧来莲之花应聘初审过参加面试的医生我们会报单程经济仓机票或高铁二等票和广州五星酒店住宿费入职时也可以报机票或高铁票另给百元的临时住宿补贴广州珠江新城
4652757128577320,注意月日起百色市新冠病毒疫苗接种将全面转向第一剂次为主百色市新冠肺炎疫情防控指挥部办公室发布最新通告根据自治区的统一部署安排月日日是新冠病毒疫苗第剂次大规模集中接种的最后一次重要节点月日起我市将陆续转向第剂次接种月日起將全面转向以第剂次接种为主请已接种新冠病毒疫苗第剂次未接种第剂次的市民朋友按当地疫情防控指挥部通知及时携带本人身份证原件和首针接种凭证前往各接种点有序排队完成第剂次疫苗接种
4652756981515684,封城第二天疫情悉尼澳大利亚悉尼
4652721338318975,刚刚当值主任和人事主管请示原计划月入职的两位医生可否正常入职疫情应该问题不大了正常入职吧来莲之花应聘初审过参加面试的医生我们会报单程经济仓机票或高铁二等票和广州五星酒店住宿费入职时也可以报机票或高铁票另给百元的临时住宿补贴广州珠江新城
4652757128577320,注意月日起百色市新冠病毒疫苗接种将全面转向第一剂次为主百色市新冠肺炎疫情防控指挥部办公室发布最新通告根据自治区的统一部署安排月日日是新冠病毒疫苗第剂次大规模集中接种的最后一次重要节点月日起我市将陆续转向第剂次接种月日起將全面转向以第剂次接种为主请已接种新冠病毒疫苗第剂次未接种第剂次的市民朋友按当地疫情防控指挥部通知及时携带本人身份证原件和首针接种凭证前往各接种点有序排队完成第剂次疫苗接种
4652756981515684,封城第二天疫情悉尼澳大利亚悉尼
4652667370996594,东莞麻涌解封为统筹做好疫情防控和经济社会发展精准科学实施疫情防控结合我市疫情形势和防控工作进展经评估现就调整我市封闭封控管理区域及相关防控措施通告如下一调整区域一对东莞市新型冠状病毒肺炎疫情防控指挥部办公室关于进一步加强疫情防控工作的通告第号中个执行封闭管理的重点区域进行解封二对麻涌镇执行封控管理的住宅小区进行解封二相关防控措施一公共场所上述封闭封控场所解封前须进行一次彻底清洗消毒解封后公共场所入场人数原则上不得超过核定人数的健全进场分时段预约制度引导错峰预约进场灵活采取限流措施严格控制进场人员数量落实进场体温监测和健康码查验等防控措施麻涌镇餐饮场所有序恢复堂食按核定人数的实行限流每桌不超过人就餐每桌登记至少一名就餐客人的姓名和联系方式不安排非同行顾客同桌就餐二住宅小区所有住宅小区解封后执行天的严控管理措施设置卡口实行小时值守严格落实测温扫码佩戴口罩等防控措施禁止非必要人员及车辆进出小区保持执行三人小组健康监测和常态化防控措施居民自我健康监测每日测量体温出现发热咳嗽等症状及时报告三人小组住户实行住家单位两点一线尽量不乘坐公共交通工具小区加强环境卫生清除卫生死角加强对公共卫生间社区活动场所户外活动设施等公共部位以及垃圾站点的消毒以上防控措施依据疫情风险评估结果动态调整本通告自发布之日起施行东莞市新型冠状病毒肺炎疫情防控指挥部办公室年月日最新东莞这些封闭封控管理区域解封东莞疫情东莞发布解封通告
4652756897893800,去日本的时候在神社求了一对爱情御守我一直把它和另外两个御守都放在书包的最里层的地方从未拿出来过后来从泰国辗转回了澳洲我清楚的记得确认过三个御守是不是都还在再后来澳洲疫情爆发回国以后我打开里层爱情御守消失了另外两个御守依旧还在我一直对这些事情抱着半信半疑的态度但是这件事的发生让我对这类事产生了更多的敬畏原来这个世界上是真的有神灵的存在啊
4652664187520602,了不起的运动博主泵发力老迈最不喜欢逛街好难得和他开开心心的逛了一下午商场好多人完全回到疫情前了虽然有道菜各点了份但还是没有吃饱回家再吃点备餐允悲允悲另外周六开始的时候见图结束的时候是图差距有点大笑笑论人靠衣装的重要性允悲允悲美国圣迭戈
4652756864600359,晒娃狂魔如今在互联网上分享孩子的照片记录孩子的成长的每一个重要时刻已经成了一件很普遍的事情但是根据互联网观察基金会的报告显示网络上虐待儿童图像的数量在疫情期间增加了照片化的数据被滥用甚至被不怀好意地使用不仅侵犯了孩子的隐私权还对孩子的身心安全造成危害因此家长在晒娃前不妨多想想其安全隐患下面这篇文章将带我们了解更多在海外网上晒娃的危险晒娃需谨慎不要让孩子暴露在危险中
4652748500897913,亞神小助手楊乃文繆斯演唱會確定延期公告因受台灣地區疫情影響為了歌迷朋友及全體人員的健康楊乃文繆斯演唱會確定延期在這個時期許多計畫被迫停擺大多數的我們能做的就是好好保護自己乖乖待在家由於前線人員的努力世界的齒輪才能持續轉動時間雖然不會停下但等待不會白費一起靜候平安到來再一次推開世界的門演唱會延期日期售票資訊待疫情明朗後將會公布請大家持續關注我們烏雲總會散去陽光終會灑落在親臨繆斯殿堂的那天到來前一起努力做好防疫讓音樂伴你度過楊乃文演唱會繆斯
