content,id
4652662798159575,我心中最闪耀的红星总有一种力量激励我们前行赞啊他们中有人穷其一生投身科技事业有人舍生忘死传承民族精神有人不惧危难奋战疫情一线有人坚守信念点亮一方希望一百年风雨兼程一百年砥砺奋进他们是这个时代的楷模是心中最闪耀的红星转发点赞赞说出你心中最闪耀的红星让榜样的力量激励我们前行让奋斗的光芒闪耀新征程微博放映厅宝藏蓝激励计划科技日报的微博视频
4652752674751704,四川新冠病毒疫苗第二剂接种累计超过万剂次疫情防控截至月日时分四川省新冠病毒疫苗第二剂次接种累计超过万剂次截至目前四川省已累计接种多万剂次据了解自月日四川省启动第二剂次集中接种工作以来日均接种量在万剂次以上来源健康四川官微健康四川官微
4652721103181155,广州荔湾北片区恢复餐饮堂食刚刚广州荔湾发布广州荔湾发布最新消息今天起荔湾区北片区域包括金花街西村街南源街逢源街多宝街龙津街昌华街岭南街华林街沙面街站前街彩虹街桥中街等条街道的社会餐饮服务单位恢复堂食服务涉疫重点场所严格按照规范评估合格后方可复业广州疫情
4652752543942636,第篇粉丝投稿鼓掌鼓掌鼓掌最擅长等待双向奔赴的旅程幸福一路都在盛开又一位在疫情期间喜欢上喜欢权志龙的粉丝而且她的班主任喜欢听他们的歌有次她还把龙写进周记得到了语文老师的认可她的美术老师去过龙的演唱会也和她分享了照片和视频都是助攻啊哈哈具体投稿说明请点击链接网页链接权志龙权志龙准备回归
4652490560114400,想想还是挺遗憾的因为疫情没有毕业旅行也好久都没有旅行了上海
4652741823566598,小朋友之间的友情隔着屏幕都是甜的因为广州疫情很久没见面的好朋友解封后见的第一面就是大声说我好想你啊奔跑的小朋友像裹了彩虹笑神来啦的微博视频
4652677348201081,伦敦爆发大规模示威活动数千民众不顾疫情聚集街头高呼自由伦敦爆发大规模反封锁抗议环球网辽宁共青团的微博视频
4652752447999225,疫情常态化重新定义居住新时代随着年广州新一轮新冠肺炎疫情的返潮广州部分区域已经实行了严格的居家管理措施居家积极成为疫情严重区域控制疫情扩散的一种有效方式在疫情常态化防控的背景下人们对于健康生活方式的思考变得更加深入这种小时宅家的生活方式对于房地产的产品需求和设计思路则提出了新的要求详戳疫情常态化重新定义居住新时代
4652752418638196,台湾首现德尔塔变异毒株本土病例据台湾流行疫情指挥中心昨天通报台湾地区新增例新冠肺炎确诊病例其中例为本土病例例境外输入病例另有例死亡病例近日更是出现了首例德尔塔变异毒株本土病例深圳卫视正午分的微博视频
4652738066254150,狗的脖子拴着上一条链子而台湾脖子上也有一条链子握在外国人手里台湾省某些人不在乎疫情逝者却在父亲节为美国的狗哀悼死了一条狗还有千千万条养在中国的狗跳出来狗的脖子拴着上一条链子而台湾省某些人的脖子上也有一条链子握在外国人的手里台湾做疫苗乞丐国际乞丐向全世界乞讨疫苗竟让立陶宛捐赠统一是历史的必然趋势假如某些人继续执迷不悟下去等待他们的只能是历史的审判中国台湾台湾台湾疫情台湾疫苗疫苗疫情新冠疫苗台湾沦为疫苗乞丐美国集合新时代军事军事分享官祖国必须统一也必然统一正能量搞笑台湾辰瑞的两岸观察台湾辰瑞的两岸观察的微博视频
4652738066254150,狗的脖子拴着上一条链子而台湾脖子上也有一条链子握在外国人手里台湾省某些人不在乎疫情逝者却在父亲节为美国的狗哀悼死了一条狗还有千千万条养在中国的狗跳出来狗的脖子拴着上一条链子而台湾省某些人的脖子上也有一条链子握在外国人的手里台湾做疫苗乞丐国际乞丐向全世界乞讨疫苗竟让立陶宛捐赠统一是历史的必然趋势假如某些人继续执迷不悟下去等待他们的只能是历史的审判中国台湾台湾台湾疫情台湾疫苗疫苗疫情新冠疫苗台湾沦为疫苗乞丐美国集合新时代军事军事分享官祖国必须统一也必然统一正能量搞笑台湾辰瑞的两岸观察台湾辰瑞的两岸观察的微博视频
4652752129232782,观鹤社区三人小组妙招助力高效排查在这次广州疫情防控工作中由医护人员社区志愿者公安民警组成的三人小组冲在抗疫最前线为居民筑起社区防控墙面对巨大的工作量他们有什么好办法提高工作效率我们一起去看看观鹤社区的三人小组是怎么做的广州交通电台的微博视频
4652747309975913,台湾首现德尔塔变异毒株据台媒报道台湾屏东一对从秘鲁返台的祖孙确诊经基因定序后确定感染德尔塔新冠肺炎变异毒株陆续传给人台湾地区疫情流行指挥中心日公布人的基因定序结果皆为德尔塔变异毒株为防堵该病毒株台湾地区自日起将全面提升入境人员检疫措施环球网环球网
4652751894349024,周杰伦不参加中国好声音宝藏星视频中国好声音曾经官宣周杰伦回归担任导师现在又因疫情原因不能参加你怎么看待此事的微博视频
4652730272451083,京都伊藤久右衛門的紫阳花芭菲再次登场今年因为疫情可以外带了本店附近还有紫阳花名所三室戸寺去看紫阳花时可以顺便打个卡地址京都府宇治市莵道荒槇日本旅行京都旅行网页链接
4652674970030448,特朗普口中的假新闻台在台湾打假了台湾的高端疫苗生产状况堪忧被批像个家庭作坊台湾疫情偏执狂的微博视频
4652740301029506,禽流感猖狂那会儿有鸡精企业跳出来坦白说自家鸡精一点鸡都没有鸡只是形容词像鸡一样疫情在武汉刚开始那会儿一个叫武汉鸭脖王的赶紧跳出来贴安民告示说自家用的是本地鸭不是武汉鸭农夫山泉这次应该是被打擦边球的文案营销给坑了硬要加一点日本元素进来估计是看元气森林用一个日本字就成爆款了发现了很多人网上骂日本骂得狠心底里爱日货喝个水都要和日本攀个亲沾点边我可以负责任地说确实要相信农夫山泉确实和日本啥关系都没有农夫山泉否认涉日本福岛进口成分延边汪清县
4652751630631149,城市追击香港香港今增宗病例新达广场女职员确诊大埔中心座强检变种新冠病毒入侵再有社区爆发危机卫生防护中心公布本港今日日新增宗确诊个案其中宗为输入病例以及宗与本地相关个案患者为名岁女子个案编号是早前确诊变种病毒男子个案的同事她于大埔区新达广场负责顾客服务工作最后上班日期为上周三日至今本港个案累计宗另录得少于宗初步确诊香港新增例新冠肺炎确诊病例该名女患者上周四日被界定为变种病毒男子个案的密切接触者送往检疫中心昨日日发烧入院调查显示病人未有接种新冠疫苗卫生署公共卫生化验服务处的基因分析仍进行中以确定病人是否带有变异病毒株政府今日会将该病人居住的大埔中心座工作处所及在潜伏期传染期到访过的地点纳入强制检测公告女患者的同住家人已于今日凌晨送往隔离中心翻查纪录个案编号患者为岁香港航空地勤人员早前感染变异病毒株他曾在新达广场一楼兼职顾客服务工作至上周二日仍有上班输入个案方面全部宗均验出带有变种病毒有宗由英国抵港分别是岁女子及岁男子另宗均于上周一日由孟加拉抵港为同一艘货船的船员余下宗由印尼抵港为岁女外佣本月日到港于赤鱲角富豪机场酒店检疫医管局表示截至今日上午时再有名确诊病人个案编号出院至今康复人数增至人目前公立医院已启用间负压病房合共张负压病床现时共有名确诊病人分别于间公院及北大屿山医院香港感染控制中心留医其中人个案编号情况危殆人个案编号情况严重其余人情况稳定香港疫情疫情防控关注新冠肺炎东网
4652751617787690,西南证券测算按主流的两针接种法接种要达到群体免疫接种费用近亿美元而年全球的疫苗行业总规模仅亿美元这意味着新冠病毒疫情让全球疫苗市场暴增到原来的倍疫苗企业一季度营收亿美元净利润亿美元营收亿欧元净利润约为亿欧元折合约亿美元亿美元其合作伙伴辉瑞把全面新冠疫苗销售额上调到亿美元中国新冠疫苗企业成为崛起中新势力北京科兴中维不是上市公司按拥有其的中国生物制药一季度联营企业业绩推算科兴中维一季度净利润约亿元约合亿美元截止月科兴中维的出货量约亿剂其董事长尹卫东表示今年产能有望提升至亿剂暴增至倍当然下半年新冠疫苗品种会增加很多价格会被打压下来但业绩的继续大增还是可以预计的
4652751571388594,年月日南昌市新型冠状病毒肺炎疫情情况年月日江西省卫生健康委发布疫情通报年月日时江西省无新增本地新型冠状病毒肺炎确诊病例报告无新增本地疑似病例我省常态化疫情防控平稳有序截至年月日时全省累计报告本地确诊病例例累计出院病例例累计死亡病例例我省已连续天无新增本地确诊病例报告年月日时江西省无新增境外输入新型冠状病毒肺炎确诊病例报告截至年月日时全省累计报告境外输入确诊病例及关联病例例累计出院病例例无住院境外输入确诊病例及关联病例年月日时南昌市无新增本地新型冠状病毒肺炎确诊病例报告无新增本地疑似病例无新增境外输入新型冠状病毒肺炎确诊病例报告截至年月日时我市累计报告本地确诊病例例累计出院病例例累计报告境外输入确诊病例及关联病例例累计出院病例例无住院境外输入确诊病例及关联病例我市已连续天无新增本地确诊病例报告
4652684928355547,台湾疫情媒体对确诊患者进行人身攻击台媒爆了一不封城二不普筛你怎么能怪确诊者到处走
4652751211200761,新冠患者会出现沉默性低氧安静时不缺氧稍稍一动就喘不上气南方日报南方广州这一轮本土疫情中无症状感染者比例不高您如何看北京协和医院重症医学科主任隆云有时候无症状更多是病人自身感受新冠患者在先前的临床观察中往往会出现沉默性低氧也就是说安静待着的时候不缺氧而稍稍一动就会喘不上气影像往往会出现渗出改变之前的很多所谓无症状感染者从医学上角度来说是不严谨的当然不排除少数人是无症状感染但多数还是有症状病人有感冒表现比如头痛流涕畏寒低热等从临床上说符合轻症或普通型诊断首次与德尔塔变异毒株交手顶级中西医专家找到了这些新规律和方法广州疫情广东疫情
4652751088520923,东莞解封个封闭管理区对麻涌镇执行封控管理的住宅小区进行解封东莞日发布第号通告对东莞市新型冠状病毒肺炎疫情防控指挥部办公室关于进一步加强疫情防控工作的通告第号中个执行封闭管理的重点区域进行解封对麻涌镇执行封控管理的住宅小区进行解封麻涌镇餐饮场所有序恢复堂食按核定人数的实行限流本通告自发布之日起施行广州日报
4652751084061056,孙仔满月留家庆祝薛家燕唔食饭都要抱孙艺人薛家燕下午到荃湾为代言厨具站台宣传期间大派礼物场面墟冚她透露孙儿本月日刚好满月但因疫情关系只留家庆祝一家人喺屋企食饭食猪脚姜烧肉红鸡蛋仲有切蛋榚我个仔啱啱度过首个父亲节我哋成餐饭都系讲问到她是否经常争抱孙薛家燕笑答梗系我个仔叫我食完饭先抱我又惊到时个孙瞓咗觉梗系抱完先啦她又透露孙仔已取名石汶栩英文名就叫中文名系亲家请教人改嘅我问过师傅都话希望佢聪明伶俐快高长大李居明师傅都赞孙仔面相同八字生得好令人羡慕薛家姐称目前孙仔貌似爸爸体重已增至十馀磅抱到手倦记者笑问乖孙是否已斟茶给她她谓一早斟咗啦依家每次帮佢换片要遮住问到会否希望儿子尽快追多个她表示新抱仍坐月中加上喂哺母乳已经很辛苦故不想给压力但倘若能够凑成一个好字当然好我之前仲同胡枫讲想学佢百子千孙帮孙仔开设教育基金唔使咁急呢啲留畀佢父母揸主意啦
4652750988902655,广州中风险地区清零鹤园小区居民回家昨天下午广州的中风险地区清零目前全市均为低风险地区但为了最大限度保障安全荔湾区白鹤洞街的鹤园小区依然严格管理秩序井然广州电视记者杨时秋报道广州疫情广州交通电台的微博视频
4652750979207782,罗马的金宫在疫情后首次重新向公众开放伴随着一场沉浸式展览这场展览原本应该在年举办作为拉斐尔逝世周年纪念但因为疫情推迟到今年当时在发现金宫的古代壁画过程中拉斐尔做过很大贡献展览起名为拉斐尔和金宫穴怪图像的发现在尼禄的八角厅开幕当年通过八角厅的圆顶拉斐尔和其他艺术家用绳索降落到这座巨大的遗址内发现了久违的华丽画作植物动物人物形态交织在一起这种风格后来被称为穴怪图像这些画作在年首次曝光后来穴怪图像被许多贵族用来装饰房屋比如佛罗伦萨的乌菲兹和旧宫展览时间年月日年月日周一周四有陪同周五周日有讲解员周末的参观比平日的内容多票价周一周四欧周五周日欧地点入口公园内图意大利旅行罗马旅行
4652750916553044,新加坡卫生部通报岁退休老妇第例月日病逝她有癌症高血压高血脂病史是岁印尼籍女佣第例的家居接触者属于编号感染群由于她曾到过第座红山景巴刹与小贩中心和旁边的第座组屋商铺月日响应号召参加普筛同日出现发热症状同日检测结果为阳性确诊她未曾接种冠病疫苗这是继月日岁男子病逝之后六天内的第二起死亡病例也是新加坡的第起死亡病例近期红山中峇鲁几个感染群出现多个老龄病例而且相当多尚未接种情况恐不乐观新加坡疫情今日新加坡新加坡
4652750909211635,泰国疫情泰国曼谷发现首例变种病毒感染者泰国网报道据泰媒月日最新消息泰国首都曼谷发现首例变种病毒南非感染者病例初步得知该病例为泰国南部陶公府关联病例其他具体详情官方将于后续公布来源三台早报网页链接
4652357146640967,苗苗苗客服热线需求立马满足酷中国电信广东江门分公司接蓬江区政府要求紧急开通疫苗接种客服热线任务中国电信蓬江区分公司防疫应急工作组启动应急处理机制各战线分工合作克服坐席安装地址缺乏资源无室内电话缺失等等困难与政府沟通现场坐席细节科学组织系统受理现场因地制宜设计布线方案紧张有序推进苗苗苗热线尽早开通小时防疫应急工作组顺利实施后台录入现场布线入机调测终于在月日晚上确认户苗苗苗呼叫热线全线调通提前小时交付使用同时中国电信江门蓬江区分公司更为疫苗接种热线增设了来电名片以及企业视频彩铃等增值功能大大增加了疫苗接种客服热线的权威度获得蓬江区政府点赞广东疫情电信有爱翼起抗疫国资小新国资小新
4652750644187228,健身运动体脂脂肪体测报告点是年月份去年疫情时候肚子超胖对比现在瘦很多腰臀比身体健康指数分还行体脂率刚运动完口渴水分不足这几天换旅店熬夜睡眠不规律今天早上还饿醒了而且胃疼好像体重下降代谢一般需要健康规律饮食常备干粮还不错咯继续加油兔子耶上海博库书城宜山路店
4652750644187228,健身运动体脂脂肪体测报告点是年月份去年疫情时候肚子超胖对比现在瘦很多腰臀比身体健康指数分还行体脂率刚运动完口渴水分不足这几天换旅店熬夜睡眠不规律今天早上还饿醒了而且胃疼好像体重下降代谢一般需要健康规律饮食常备干粮还不错咯继续加油兔子耶上海博库书城宜山路店
4652686756283298,今年广东卷中考语文作文这才是少年该有的模样所以苹什么说去年我辛辛苦苦背了一堆关于疫情的好词好句最后让我给李华写信微笑好呀耶
4652741764843840,张泽禹打张泽禹第一主唱翻相册每次都有新发现这是疫情期间大禹在家跟吉他老师的隔空合奏已经老师同意后发出这瓶江小白我干了的微博视频
4652750405110814,台湾疫情台疫苗紧张一工厂拟包机送员工到关岛打针台湾地区今日日新增宗新冠病毒本土确诊个案再多人染疫不治由于岛内新冠疫苗持续紧张台湾内存模组大厂威刚日发布内部公告为体恤员工接种新冠疫苗的不易提供关岛接种疫苗行程威刚包机项目公司向每名员工提供万元新台币的补助员工还需自费万元新台币前往关岛接种疫苗据该公司负责人表示包机计划月日前往员工可在强生辉瑞莫德纳这三款疫苗中自选一种不过现时该公司仍未确定航班及人数而员工打完疫苗回台后仍要配合防疫要求隔离天员工届时要遥距办公大公文汇全媒体
4652750404847718,卫福部通报变种病毒有疏失蓝营青年天落差谁造成的印度变种病毒在屏东爆发疫情国民党青年部主任陈冠安批评但大家却亲眼看到屏东县长潘孟安是如何一边拿确诊当作政绩让民众误以为社区环境安全实际上却可能暴露在危险之中他要问位秘鲁归国的确诊者日确诊收治屏东县府到日才公布相关资讯这天落差是谁造成的
4652750404585966,话筒广州交警关于荔湾大队交通违法处理窗口恢复对外办公的通告据广州交警广州交警最新消息根据广州市人民政府网发布广州市新型冠状病毒肺炎疫情防控指挥部关于荔湾区芳村片区调整分级分类防控措施的通告第号通告明确荔湾区芳村片区鹤园小区除外在落实好疫情防控措施的基础上自月日起恢复对外人员和交通通行荔湾交警大队交通违法处理窗口广州市荔湾区塞坝路号将于月日起恢复对外办公网页链接
4652750379418551,澳大利亚新南威尔士州新增例新冠肺炎确诊个案该州州长预计当地确诊数字未来数天还会进一步上升新南威尔士州增至人感染较高传播性的变种病毒邻近的昆士兰州也公布新增两例本土感染涉及在英国首先发现的变种病毒新南威尔士州政府昨天宣布悉尼及周边地区封城两星期直至下月日新西兰昨天叫停与澳大利亚的旅游气泡为期日澳大利亚疫情全球疫情
4652750238124714,张硕辅温国辉到广州呼吸研究中心调研月日广州市委书记张硕辅广州市委副书记市长温国辉到广州呼吸研究中心调研广州疫情防控和重大项目建设情况现场协调解决问题中国工程院院士钟南山参加广州电视记者马俊健报道广州交通电台的微博视频
4652740028404503,汗疫情影响我们第三届乡村摄影活动培训推迟了一个多月孩子们都放暑假了就当暑假夏令营活动吧继续发之前拍的照片就在我湖南老家村里拍的
4652750211911325,小事实干暖心为民月日增城区公安分局民警辅警在开展交通疫情勤务工作中拾到群众钱包重要证件等物品并及时寻找失主归还物品在花莞高速仙村北出口分局警务保障室民警单锦华发现一钱包被遗漏在核酸检测点单锦华迅速妥善保管钱包并通过受检群众登记表逐一打电话询问最终找到了失主失主返回检测点后单锦华与失主认真核对并归还失主对执勤民警表示感谢在广河高速正果西出口分局刑警大队民警黎伯桂刘俊彬拾到一本行驶证里面装有身份证银行卡两名同志通过智慧新警务手段迅速找到失主电话联系后却发现失主是一名岁的老人两名同志考虑到老人不方便再次返回在顺利完成勤务工作后到与老人约定的地点将失物完整归还谢谢太有心了老人非常感激民警们的帮助广州公安广州公安我为党旗添光彩我为群众办实事
4652750014776225,小强快评广东齐心抗疫一个月连打三场硬仗守护美好家园这两天朋友圈好多人都在转这样一个段子全国都在为广东加油而广东人在喊着欧洲杯加油不出门不乱跑行但在家里不收看足球赛那不行这样一个略带调侃的段子我想也折射出了广东人面对疫情不失乐观的本色一个月内连遇三场境外输入疫情连打三场阻击战广东可谓是步步惊心硬是打出了一场反守为攻精准消灭的亮剑之战第一场广州战疫迎战印度首发的变异病毒这是引起的国内首起本土聚集性疫情首发病例为一位荔湾阿婆疫情以早茶传播链迅速蔓延为此广东立刻发动闪电战要的就是一个字快原本国家要求在小时内完成的流行病调查工作广东在小时之内全部完成就是要和病毒抢时间用什么去抢用科学防控去抢用不眠不休去抢用上下一条心去抢然而变异毒株的凶猛异于往常在判断疫情已有社区传播的苗头之时广州立下决心将疫情高风险地区居民全数转移至隔离宾馆包吃包住把病毒放在自己的眼皮子底下设下口袋随时收网狭路相逢主动亮剑而就在的这一天深圳战疫同步开打以盐田港为首战场迎战英国首发的变异病毒广东的两个一线城市面临两种新型对手的同步夹击变异株刚一上岸首发病例一名入境货轮船箱理货员便在重点作业人群例行检测中被发现随后深圳立即展开精准消灭战迅速排查相关人员严格管理涉疫小区分级分类精准防控位感染者皆为主动排查发现第三场深圳东莞战疫首发病例为深圳机场的一名入境流调人员病毒自入境后借道一位双城生活的市民潜入东莞研究发现疫情的变异株基因序列与国际航班输入病例高度同源但与在广州发现的变异毒株有明显差异属于另一种变异株来自印度以外的国家截至目前前两场疫情的社会面风险已经得到控制第三场仍处于短兵相接的斗法阶段隔离观察社区防控全员核酸筛查等工作也在紧张推进广东也正力争将其稳控在最短时间最小规模最终打赢第三场疫情防控阻击战来源广东广播电视台曾小强工作室广东台触电新闻的微博视频
4652641881686869,身为英国卫生大臣无视防疫规定不戴口罩也就算了还张着大嘴激吻女人吻女人也就算了吻的是下属简称小三儿吻小三儿你还不避点人居然叫大家都看见英伦三岛看得真真切切传得沸沸扬扬被疫情折磨的死去活来的英国民众愤怒了反对党更是不依不饶小金毛一时也不好犯众怒只好让卫生大臣韩考克辞职了事太阳报日头版刊登已婚的韩考克在办公室拥吻女助理照片后岁的韩考克今天向首相请辞最讽刺的莫过于韩考克在英国政府抗疫工作中扮演主要角色经常板着面孔在电视电台上呼吁大众要遵守严格防疫规定韩考克在辞呈中有退回的表示小金毛首相的表态有点奇怪收到辞呈感到遗憾你应该为你所提供的服务深感自豪我很感谢你的支持且深信你对公共服务的贡献才刚开始而已英国同美国一样尚无官员对防疫失策给民众带来巨大伤害而被追责这个辞职不过是一个英国绅士面对有伤风化事件的一个反应
