content,id
4652737038123065,忧染疫没人照顾母刺死五岁女儿伦敦一名母亲在疫情封锁期间产生心理疾病极度忧虑自己可能会感染新冠病毒并且担心染疫死亡就没人能帮忙照顾女儿于是她在丈夫外出上班后持刀朝着年仅岁的女儿狂刺下同时也在女儿面前自残最后母女俩都被送往医院但小女孩已经死亡伦敦米查姆地区一名岁母亲舒莎原本不会讲英语是在年婚后才搬到英国丈夫眼里她是非常棒的好妈妈直到年秋天开始她不断抱怨一些莫名的病痛还多次到急诊室就医年夏天则开始说自己头晕体重剩下大约公斤等等镜报报道丈夫认为对新冠病毒的恐惧与疫情封锁是导致她崩溃的原因报道指出年月日上午舒莎要求丈夫不要去上班但丈夫向她解释自己必须工作将妻子与岁大的女儿莎雅琪留在家后就出门了舒莎开始向朋友们打电话抱怨自己的健康状况很糟但没有人察觉有异下午时许相处了年的邻居听到隔壁传来尖叫与哭声前去查看才在卧室发现了这对奄奄一息的母女舒莎躺在地上一片血泊中腹部有严重刺伤报道表示伤势严重的莎雅琪躺在床上颈部胸部与腹部都被刺伤邻居发现女童肩膀里还嵌着一把刀母女俩被紧急送医后莎雅琪被证实身中刀其中刀刺中心脏被宣布死亡而舒莎则治疗了好几个月舒莎向医生表示她非常害怕自己即将死去如果自己遭遇不幸那她不知道莎雅琪该如何活下去在杀人那天她好像在做梦我没有意识到我正在伤害她舒莎的丈夫在法庭上表示防疫封锁政策可能已对她的健康产生更负面的影响她认真对待这些限制对染疫感到害怕检察官比尔表示被告带着病态般的担忧罹患严重疾病却未被诊断案发前一晚舒莎曾明确询问丈夫如果她去世他是否会好好照顾孩子据报道舒莎被诊断出严重忧郁与精神疾病被强制送往精神科医院接受无限期的治疗
4652736573080899,来到一个新的城市认识一些新的朋友开始一段新的生活遇上了疫情今天正好全城变为低风险预约了广东省博物馆广州市图书馆满满的一天广东之旅就从博物馆开始
4652736534022608,家附近有个大商场以前走的是高端精致路线里面的品牌就没几个中国字一直非常冷清就是那种营业员比顾客多好几倍人走在里面听得见自己脚步声那种冷清疫情之后突然性情大变极速向其他商场靠拢增加了很多餐饮商户小孩子玩的小火车也开起来了各种儿童游乐项目也引进来了新引进的品牌也都是大家认识的了突然就变的非常接地气人气迅速上升现在已经火爆到很多商户要排队了以前的门可罗雀恍如隔世但是再也找不回以前的逼格了感叹一句得屌丝者得天下
4652698685411302,我对中国白酒的研究非常用心的关于武陵酒富硒抗癌是停留在我自己的人生经历悟出的真沒有科学统计数据支持年我父亲食道癌我们借钱买的药主要成分是硒也沒救活武陵是在湖北恩施和湘西桃源富硒一带下游百公里处我有此推断疫情期间我仔细统计中国各大酒厂所在地区舍得茅台五粮液汾老白干染疫概率最低与舍得一年十倍没有关系吗
4652734822748022,基层卫生院的人就能力不行呗在基层不仅要会拿药要会挂盐水要会看检验单要会体检现在疫情疫苗打针任务重然后妇保肺结核死亡证明慢性病随访量血压测血糖真不知道自己是能力差还是能力强
4652734781851738,天公不作美暴雨加打雷疫情没那么紧张可以出来闲逛吹吹风放松心情以为可以上桥欣赏美景失落透顶下雨汗广州花城汇
4652729823922022,凯尔希的医务室切勿盲目相信没有写在说明书上的功效罗德岛抗疫指南凯尔希博士我们需要进行疫苗注射以防止疫情的蔓延博士好的凯尔希这次注射的是科兴公司提供的疫苗吧我前两天在微博上有看到据说注射科兴疫苗后好像会变大变长变漂亮嘿嘿嘿污污污凯尔希喂喂喂博士你那是什么表情啊怒怒怒根据报告上看科兴疫苗并没有你期待的网络上写的那种特别功效博士还请科学理性切勿盲目相信没有写在说明书上的功效凯尔希
4652734248651683,东京奥运会即将到来日本疫情却未能得到控制日本想要彻底摆脱疫情的困扰还有一段相当长的要走当前日本各界都在担忧疫情无法控制可菅义伟所担忧的却是如何堵住那些反对者的嘴然而在奥运会问题上天皇都跟他唱反调日前日本宫内厅长官西村泰彦对记者说天皇非常担忧在新冠疫情的形势下举办奥运会是否会导致疫情扩散受日本现行宪法的限制德仁天皇很少对国政发表评论此次罕见做出如此表态以至于大部分日本学者和媒体都说这是战后皇室极为罕见的特例有日本学者批评菅义伟奥运会举办与否可不是什么政治问题而是科学问题现在的菅义伟也是一个头两个大了
4652733941940984,高明堂食最新通告不超过餐桌数佛山市高明区新型冠状病毒肺炎疫情防控指挥部办公室关于进一步调整餐饮场所防控措施的通告为进一步贯彻落实新冠肺炎疫情分类分级精准防控的工作要求根据全市疫情防控形势结合我区实际现就进一步调整我区餐饮场所防控措施相关事项通告如下一全区所有餐饮场所在原有恢复部分堂食服务的基础上大堂餐桌实际使用数量不超过餐桌之间距离不少于米二餐饮场所须实行亮码粤康码进场每桌每批次须登记一名联系人对于老年人未成年人及不能熟练使用智能手机的人员可由同行人员按规定代为在线上申领粤康码并出示或持彩色打印的粤康码绿码天之内有效进场三要求顾客落实进门三件事亮码测体温戴口罩开始进餐时才脱掉口罩进餐完成后立即戴上口罩在候餐区取餐区结账区落实一米线要求有条件的餐饮场所用餐区出入口分开设置四提供公勺公筷每桌每批次顾客用餐后餐饮单位应对桌椅进行消毒以上防控措施依据疫情风险评估结果动态调整本通告自发布之时起实施佛山市高明区新型冠状病毒肺炎疫情防控指挥部办公室年月日高明堂食最新通告不超过餐桌数
4652385593198337,受疫情影响原定年年末在巴黎蓬皮杜艺术中心举行的蔡明亮导演个展将推迟至年进行
4652721795236406,伦敦爆发反封锁大抗议人群绵延数英里推特网友质疑呢当地时间日英国伦敦爆发反对疫情封锁措施的大游行目前有关伦敦抗议的词条已经登上了海外社交媒体推特的热搜然而有网友发现该国著名媒体英国广播公司似乎选择了沉默看不见这场游行今日俄罗斯称英国首相约翰逊最近决定将该国重新开放的时间推迟到下月晚些时候然而这一决定并不受民众欢迎日示威者走上伦敦街头表达他们的不满还援引相关推测称当天的抗议人群数可能高达数十万有网友提到抗议人群绵延英里有推特网友提出质疑在相关图片和视频已经火遍推特的情况下英国广播公司却选择了沉默也有人为鸣不平称几小时前曾报道过有关新闻然而网友很快将这篇所谓的报道抓包有人表示这条新闻并没有出现在网站首页文章挂了分钟就塞到不知道什么地方了有人提到原文根本是避重就轻不是诚实的报道还有人质疑称现场抗议人数远超标题中声称的数千人是在撒谎环视频的微博视频
4652715173218995,彩礼种姓制度妇女地位印度童婚现象为什么屡禁不止印度疫情大暴发童婚现象加剧岁的男人和岁幼女结婚岁女孩有了婚约为襁褓中的婴儿举行婚礼未成年当母亲无尽的家务为何印度童婚现象屡禁不止印度女性的未来该何去何从风视频的微博视频
4652705635895758,暑假快到了中国好声音也要来了今年是中国好声音举办的第十年组办方有意改变原来只有四位导师的赛制增设五位导师其中张惠妹周杰伦都是导师之一在年初的官宣上周杰伦都已经露脸了但如今出现了一个小的变数因为台湾疫情的关系且情况一直没有好转周杰伦已经拒绝了节目组的邀约另外张惠妹考虑到往来大陆与台湾需要隔离且一去就是几个月她放心不下家里还是决定放弃了一下就有两个导师退出了节目组而节目组很快就继续寻找新的导师其中李克勤成为了代替周杰伦的导师这件事已经得到了他的经纪人霍汶希已经确认她表示组办方很欣赏李克勤的幽默与事业能够带领到学员进步而如果成事李克勤将会有逾千万的收入也将成为谢霆锋陈奕迅之后第三位来自香港的导师
4652735847203683,清理照片时发现除夕时整理的信息里面还包括新闻爆发时我在新加坡一无所知的旅行即使是在疫情依然还存在的今天这些好像都已经过去就让这些留下痕迹
4652734822748022,基层卫生院的人就能力不行呗在基层不仅要会拿药要会挂盐水要会看检验单要会体检现在疫情疫苗打针任务重然后妇保肺结核死亡证明慢性病随访量血压测血糖真不知道自己是能力差还是能力强
4652734781851738,天公不作美暴雨加打雷疫情没那么紧张可以出来闲逛吹吹风放松心情以为可以上桥欣赏美景失落透顶下雨汗广州花城汇
4652729823922022,凯尔希的医务室切勿盲目相信没有写在说明书上的功效罗德岛抗疫指南凯尔希博士我们需要进行疫苗注射以防止疫情的蔓延博士好的凯尔希这次注射的是科兴公司提供的疫苗吧我前两天在微博上有看到据说注射科兴疫苗后好像会变大变长变漂亮嘿嘿嘿污污污凯尔希喂喂喂博士你那是什么表情啊怒怒怒根据报告上看科兴疫苗并没有你期待的网络上写的那种特别功效博士还请科学理性切勿盲目相信没有写在说明书上的功效凯尔希
4652734248651683,东京奥运会即将到来日本疫情却未能得到控制日本想要彻底摆脱疫情的困扰还有一段相当长的要走当前日本各界都在担忧疫情无法控制可菅义伟所担忧的却是如何堵住那些反对者的嘴然而在奥运会问题上天皇都跟他唱反调日前日本宫内厅长官西村泰彦对记者说天皇非常担忧在新冠疫情的形势
4652733941940984,高明堂食最新通告不超过餐桌数佛山市高明区新型冠状病毒肺炎疫情防控指挥部办公室关于进一步调整餐饮场所防控措施的通告为进一步贯彻落实新冠肺炎疫情分类分级精准防控的工作要求根据全市疫情防控形势结合我区实际现就进一步调整我区餐饮场所防控措施相关事项通告如下一全区所有餐饮场所在原有恢复部分堂食服务的基础上大堂餐桌实际使用数量不超过餐桌之间距离不少于米二餐饮场所须实行亮码粤康码进场每桌每批次须登记一名联系人对于老年人未成年人及不能熟练使用智能手机的人员可由同行人员按规定代为在线上申领粤康码并出示或持彩色打印的粤康码绿码天之内有效进场三要求顾客落实进门三件事亮码测体温戴口罩开始进餐时才脱掉口罩进餐完成后立即戴上口罩在候餐区取餐区结账区落实一米线要求有条件的餐饮场所用餐区出入口分开设置四提供公勺公筷每桌每批次顾客用餐后餐饮单位应对桌椅进行消毒以上防控措施依据疫情风险评估结果动态调整本通告自发布之时起实施佛山市高明区新型冠状病毒肺炎疫情防控指挥部办公室年月日高明堂食最新通告不超过餐桌数
4652385593198337,受疫情影响原定年年末在巴黎蓬皮杜艺术中心举行的蔡明亮导演个展将推迟至年进行
4652721795236406,伦敦爆发反封锁大抗议人群绵延数英里推特网友质疑呢当地时间日英国伦敦爆发反对疫情封锁措施的大游行目前有关伦敦抗议的词条已经登上了海外社交媒体推特的热搜然而有网友发现该国著名媒体英国广播公司似乎选择了沉默看不见这场游行今日俄罗斯称英国首相约翰逊最近决定将该国重新开放的时间推迟到下月晚些时候然而这一决定并不受民众欢迎日示威者走上伦敦街头表达他们的不满还援引相关推测称当天的抗议人群数可能高达数十万有网友提到抗议人群绵延英里有推特网友提出质疑在相关图片和视频已经火遍推特的情况下英国广播公司却选择了沉默也有人为鸣不平称几小时前曾报道过有关新闻然而网友很快将这篇所谓的报道抓包有人表示这条新闻并没有出现在网站首页文章挂了分钟就塞到不知道什么地方了有人提到原文根本是避重就轻不是诚实的报道还有人质疑称现场抗议人数远超标题中声称的数千人是在撒谎环视频的微博视频
4652715173218995,彩礼种姓制度妇女地位印度童婚现象为什么屡禁不止印度疫情大暴发童婚现象加剧岁的男人和岁幼女结婚岁女孩有了婚约为襁褓中的婴儿举行婚礼未成年当母亲无尽的家务为何印度童婚现象屡禁不止印度女性的未来该何去何从风视频的微博视频
4652737284801542,疫情不能堂食很久都没有出来约会啦来打卡一下网红店的咖啡馋嘴很可爱味道还行不过下次不来了笑打包两个司康回去慰劳一下带娃的老爸老妈吧偷笑广州正在司康咖啡司康专门店长隆分店
4652737138524651,超低泰国酒店疫情过后躺着赚钱泰国酒店北京一套房泰国一个酒店韩磊不愤青的微博视频
4652737063815475,无惧感染伦敦万人上街游行示威受变种新冠病毒影响的英国疫情持续反弹单日新增宗确诊个案是月日以来最多再多名患者死亡当地时间日伦敦有上万人上街游行示威在商业中心和政府机构周围示威活动的诉求包括反防疫封锁等一些示威者还包围了唐宁街首相府几千人日在伦敦市中心游行抗议政府推迟四星期解除防疫措施认为封锁措施影响民众的自由和权利中央电视台报道为了预防与示威相关的暴力活动发生伦敦警方日开始突袭了三个地方没收了一些示威用具其中有用于封锁道路的竹制装置等警方宣布已逮捕至少人政府统计显示境内日新增人确诊感染者是自月日以来单日最高纪录过去一周将近万人病毒检测呈阳性较前一周增加约疫情升温引发质疑能否如计划于月日解除防疫封锁措施由于最先在印度发现的变异病毒株肆虐过去几周以来每日确诊病例相当快速攀升政府科学家认为此变异病毒株的传染力较先前的主流病毒株高出到如今已占英国境内几乎全部新增病例大部分新确诊病例都是尚未施打疫苗的年轻年龄族群截至日将近英国人口已接种至少一剂疫苗同时有人口已接种两剂英格兰公共卫生署最近的分析显示施打两剂英国使用的主要疫苗能高度有效预防感染变异株住院辉瑞疫苗保护效果达阿斯特捷利康疫苗则为有统计显示英国自年以来首次出现死亡率超过出生率的现象英国广播公司报道受疫情影响去年的死亡人数急速上升虽然去年共有万个宝宝出生但是死亡人数却接近万
4652737038123065,忧染疫没人照顾母刺死五岁女儿伦敦一名母亲在疫情封锁期间产生心理疾病极度忧虑自己可能会感染新冠病毒并且担心染疫死亡就没人能帮忙照顾女儿于是她在丈夫外出上班后持刀朝着年仅岁的女儿狂刺下同时也在女儿面前自残最后母女俩都被送往医院但小女孩已经死亡伦敦米查姆地区一名岁母亲舒莎原本不会讲英语是在年婚后才搬到英国丈夫眼里她是非常棒的好妈妈直到年秋天开始她不断抱怨一些莫名的病痛还多次到急诊室就医年夏天则开始说自己头晕体重剩下大约公斤等等镜报报道丈夫认为对新冠病毒的恐惧与疫情封锁是导致她崩溃的原因报道指出年月日上午舒莎要求丈夫不要去上班但丈夫向她解释自己必须工作将妻子与岁大的女儿莎雅琪留在家后就出门了舒莎开始向朋友们打电话抱怨自己的健康状况很糟但没有人察觉有异下午时许相处了年的邻居听到隔壁传来尖叫与哭声前去查看才在卧室发现了这对奄奄一息的母女舒莎躺在地上一片血泊中腹部有严重刺伤报道表示伤势严重的莎雅琪躺在床上颈部胸部与腹部都被刺伤邻居发现女童肩膀里还嵌着一把刀母女俩被紧急送医后莎雅琪被证实身中刀其中刀刺中心脏被宣布死亡而舒莎则治疗了好几个月舒莎向医生表示她非常害怕自己即将死去如果自己遭遇不幸那她不知道莎雅琪该如何活下去在杀人那天她好像在做梦我没有意识到我正在伤害她舒莎的丈夫在法庭上表示防疫封锁政策可能已对她的健康产生更负面的影响她认真对待这些限制对染疫感到害怕检察官比尔表示被告带着病态般的担忧罹患严重疾病却未被诊断案发前一晚舒莎曾明确询问丈夫如果她去世他是否会好好照顾孩子据报道舒莎被诊断出严重忧郁与精神疾病被强制送往精神科医院接受无限期的治疗
4652736573080899,来到一个新的城市认识一些新的朋友开始一段新的生活遇上了疫情今天正好全城变为低风险预约了广东省博物馆广州市图书馆满满的一天广东之旅就从博物馆开始
4652736559189569,超亚小王子外科口罩只拍下减成人儿童款都有环氧乙烷灭菌干净卫生防护力也疫情没结束外出记得戴口罩需要的囤起
4652736534022608,家附近有个大商场以前走的是高端精致路线里面的品牌就没几个中国字一直非常冷清就是那种营业员比顾客多好几倍人走在里面听得见自己脚步声那种冷清疫情之后突然性情大变极速向其他商场靠拢增加了很多餐饮商户小孩子玩的小火车也开起来了各种儿童游乐项目也引进来了新引进的品牌也都是大家认识的了突然就变的非常接地气人气迅速上升现在已经火爆到很多商户要排队了以前的门可罗雀恍如隔世但是再也找不回以前的逼格了感叹一句得屌丝者得天下
4652698685411302,我对中国白酒的研究非常用心的关于武陵酒富硒抗癌是停留在我自己的人生经历悟出的真沒有科学统计数据支持年我父亲食道癌我们借钱买的药主要成分是硒也沒救活武陵是在湖北恩施和湘西桃源富硒一带下游百公里处我有此推断疫情期间我仔细统计中国各大酒厂所在地区舍得茅台五粮液汾老白干染疫概率最低与舍得一年十倍没有关系吗
4652736194809796,他毕业了好难过但是还是得接受自从疫情爆发就感觉大学和他待着的剩余的时间过得飞快不知不觉现在已经变成真正的异地恋了昨天晚上哭了好久今天在高铁站到点他快检票的时候哭的哽咽了眼泪鼻涕直流有时候情绪真的控制不住虽然以后又不是见不到但是还是感觉很难受毕业季的分别真的挺伤感的唉但是祝福的话还是要说的祝我的敏杰前程似锦前路漫漫亦灿灿希望你继续兴致盎然地与世界交手一直走在开满鲜花的路上
4652731941258768,深圳确实没有任何归属感很无聊且很无趣很需要认识新的人然而没有认识人的机会调整了一个周末感觉也许应该把精力放在寻找兴趣点找到方向提高自己的工作能力上想再努力一点而不是情绪精力动力会被别人牵制做自己等深圳疫情好点急需回一趟上海或永城
4652731765362764,和王渣渣的快乐六月开箱记录插花盲盒与我无缘一整个月广州这座城市都被疫情笼罩着幸好最近终于都慢慢恢复啦祝大家拥有一个美好的周末呀爱喝奶茶的的微博视频
4652731476739464,台湾疫情台北万华出现外籍男子在街头因新冠猝死日本为何迟迟未研发出新冠疫苗促进统一根据台湾联合新闻网报道昨天晚间近时台北街头发现一名外籍男子倒卧路边警方立即通报并在救护人员到场前先按救护人员指示施以心肺复苏术但外籍男送医后仍宣告不治晚间时许医院联系警方死去的外籍男新冠肺炎确诊这就是湾湾不普筛的后果猜测此外籍男子应该是外籍劳动力根本就没有被纳入湾湾防疫视野才会导致街头猝死的惨剧可见湾湾的隐患破口会有何其之大摊手话筒
4652731236877437,带着微博去印度饮恒河水喝牛尿疫情悲惨炼狱的背后印度是如何深陷泥潭难懂阿三的世界的微博视频
4652730884560248,广州这几天依然晴天中时不时来场大骤雨伴点雷声湿度高闷热月的广州也是大啖荔枝的季节这几天广州的好消息不断今日连续天零新增全市低风险区今天连芳村也恢复了堂食与德尔塔病毒正面刚三十八天后广州终于迎来了曙光月日钟院士的对疫情的最新研判广州
4652718411482880,台湾疫情孤独的身影
4652730775242264,湖北小伙抽得一辆车后转送老家村支书借花献佛希望能帮到老家留守的爷爷奶奶们近日武汉黄陂小伙网上留言老家村支书每天免费为全村送快递暖到众人据悉小伙老家地理位置偏僻村里超三分之一都是留守老人老家支书在疫情期间曾每天跑几十公里为全村送快递小伙得知因给村支书的感动留言获赠新车后立马把车寄回了老家他称老家比较偏僻村子里留守老人比较多成叔叔村支书每天花不少时间给老人们拿寄快递挺辛苦的知道成叔叔车子坏了后才把他的事情分享出来了希望能帮上他自己也算是借花献佛了极目新闻的微博视频
4652730712592741,来自远方年时给我的震撼是在于所有人都热情毫无保留的照顾因事件登陆小岛上惊慌失措的旅客们再听让我感觉糟糕透了疫情以后这样温暖的陌生的人与人之前的关系也许不复存在我会想如果我也在其中一架飞机上她们会像照顾白人一样照顾少数族裔吗我不知道
4652712300382404,又一个下跪的台湾男子在金门回不去本岛高喊县长菜英文陈时中我给你们跪下了让我回去吧疫情原因航班取消每天早上五点去候补都没票中事台湾中事的微博视频
4652730524632356,抗击疫情海口第一批新冠疫苗移动接种车月日起停止使用月日海南日报海南日报记者从海口市卫健委获悉当前海口移动接种车基本已完成接种工作接种工作点设置将从固定移动临时接种点转为固定接种海口市第一批辆移动接种车将于月日停止使用第二批辆移动接种车将于月日停止使用截至月日海口已累计完成接种新冠疫苗万余剂万余岁以上人群接种率已达作者张期望王聘钊详戳海口第一批新冠疫苗移动接种车月日起停止使用
4652733485023900,泰国事儿泰国总理府发言人强调最高严控区府不封城泰国网报道据泰媒月日消息泰国总理府办公室发言人阿努查宣布泰国总理兼国防部长巴育上将与相关部门工作人员在疫管会议上提出的防疫政策阿努查表示政府公报网发布的自月日正式实施的相关防疫规定即会议讨论结果泰国将加强包括曼谷佛统暖武里陶公巴吞他尼北大年也拉宋卡北榄龙仔厝个疫情最高严控区的管控措施有效防止疫情传播虽出台关闭建筑工地天餐馆不可堂食及限制商场营业时间至等相关规定同时还在上述府进出口设检查站以例行检测工作但阿努查强调上述地区不封城泰国疫情来源网页链接
4652733405858286,美媒美国超新冠死亡病例未接种疫苗据美联社日报道通过分析发现美国超过的新冠死亡病例都是未接种疫苗的人报道称通过分析美国疾病控制和预防中心月发布的疫情数据发现美国当月有超过万人因新冠肺炎住院而其中只有不到人约占完成疫苗接种而在约万例新冠死亡病例中只有例约占接种了疫苗有美媒报道称美国报名接种新冠疫苗的人数越来越少接种率一直在下降由于传染性更强的德尔塔变异毒株日益受到关注美国卫生官员正在敦促大众接种疫苗中新社
4652732935833698,武汉这两年像是被赋予了什么使命一样好不容易从疫情里爬出来今年又过半泡在水里淹了好几次今天又下爆了从家里来单位短短十多公里路沿路渍水七八起追尾一路上满地掉的都是汽车零件车主们一个个或挽着裤管或拎着裙摆站在水里满脸无奈连吵架的劲儿都没有
